{
  "$schema": "https://json-schema.org/draft/2020-12/schema",
  "title": "SINGULANCE release manifest",
  "type": "object",
  "additionalProperties": false,
  "required": [
    "contractVersion",
    "environment",
    "changeClass",
    "source",
    "artifacts",
    "configurationRevision",
    "rollback",
    "canaries"
  ],
  "properties": {
    "contractVersion": { "const": 1 },
    "environment": { "enum": ["singulance_local", "enigma", "singulance_production"] },
    "changeClass": { "enum": ["worker", "runner", "core", "hyperagents", "tara"] },
    "source": {
      "type": "object",
      "additionalProperties": false,
      "required": ["repository", "branch", "commit"],
      "properties": {
        "repository": { "type": "string", "minLength": 1 },
        "branch": { "type": "string", "minLength": 1 },
        "commit": { "type": "string", "pattern": "^[0-9a-f]{7,64}$" }
      }
    },
    "artifacts": {
      "type": "array",
      "minItems": 1,
      "items": {
        "type": "object",
        "additionalProperties": false,
        "required": ["kind", "identity", "previousIdentity"],
        "properties": {
          "kind": { "enum": ["worker", "container_image", "database_migration", "runtime"] },
          "identity": { "type": "string", "minLength": 1 },
          "previousIdentity": { "type": "string", "minLength": 1 }
        }
      }
    },
    "configurationRevision": { "type": "string", "minLength": 1 },
    "featureFlag": {
      "type": "object",
      "additionalProperties": false,
      "required": ["key", "target"],
      "properties": {
        "key": { "type": "string", "minLength": 1 },
        "target": { "enum": ["legacy", "harness"] }
      }
    },
    "rollback": { "type": "string", "minLength": 1 },
    "canaries": {
      "type": "array",
      "minItems": 1,
      "items": { "type": "string", "minLength": 1 }
    }
  }
}
